{
  "$schema": "https://json-schema.org/draft/2020-12/schema",
  "$id": "contracts/observability/v1/correlation-envelope.schema.json",
  "title": "correlation-envelope",
  "description": "Versioned cross-plane correlation/event envelope (issue #272, ADR-0032 rule 5). EVIDENCE, NOT AUTHORITY: it carries identifiers, a closed status, freshness, classification and redaction state so that OMES, Hermes, AWCMS and providers can be correlated and converged. It never carries prompts, transcripts, commands, tool arguments/results, headers, credentials or reasoning, and it never grants permission or approves anything. Timestamps are UTC (`Z`) RFC 3339 strings because `format` is not in the supported validator subset; calendar validity is checked by lib/omes/py/observability/envelope.py.",
  "type": "object",
  "required": [
    "schema_version",
    "event_id",
    "source_authority",
    "tenant_id",
    "correlation_id",
    "event_type",
    "observed_at",
    "source_timestamp",
    "freshness",
    "status",
    "classification",
    "redaction_state"
  ],
  "additionalProperties": false,
  "properties": {
    "schema_version": {
      "type": "string",
      "description": "Contract version. Only major version 1 exists; a consumer MUST fail closed on any other major version.",
      "enum": ["1.0.0"]
    },
    "event_id": {
      "type": "string",
      "description": "Producer-unique event identifier; the deduplication key. Reusing an event_id with different content is rejected by the convergence reducer.",
      "pattern": "^[A-Za-z0-9_.:-]{8,128}$"
    },
    "source_authority": {
      "type": "string",
      "description": "Which authority produced the observation (mirrors the authority enum of contracts/architecture/v1/capabilities.schema.json). The producer is a witness, not the owner of the other planes' state.",
      "enum": ["omes", "hermes", "omarchy", "awcms", "graphify", "provider", "platform", "external"]
    },
    "tenant_id": {
      "type": "string",
      "pattern": "^[A-Za-z0-9_.:-]{1,128}$"
    },
    "correlation_id": {
      "type": "string",
      "pattern": "^[A-Za-z0-9_.:-]{8,256}$"
    },
    "causation_id": {
      "type": ["string", "null"],
      "description": "event_id of the event that directly caused this one; null or absent for a root event.",
      "pattern": "^[A-Za-z0-9_.:-]{8,128}$"
    },
    "trace_id": {
      "type": "string",
      "description": "W3C Trace Context trace-id: 32 lowercase hex characters, not all zeros.",
      "pattern": "^(?!0{32}$)[0-9a-f]{32}$"
    },
    "span_id": {
      "type": "string",
      "description": "W3C Trace Context parent-id/span-id: 16 lowercase hex characters, not all zeros.",
      "pattern": "^(?!0{16}$)[0-9a-f]{16}$"
    },
    "run_id": {
      "type": "string",
      "pattern": "^[A-Za-z0-9_.:-]{1,128}$"
    },
    "task_id": {
      "type": "string",
      "pattern": "^[A-Za-z0-9_.:-]{1,128}$"
    },
    "operation": {
      "type": "string",
      "description": "Allowlisted operation NAME only (never a command line).",
      "pattern": "^[a-z][a-z0-9_.:-]{0,63}$"
    },
    "event_type": {
      "type": "string",
      "pattern": "^[a-z][a-z0-9_]{0,31}(\\.[a-z0-9_]{1,32}){0,3}$"
    },
    "observed_at": {
      "type": "string",
      "description": "When the producer recorded this envelope (UTC, RFC 3339, `Z` suffix).",
      "pattern": "^[0-9]{4}-[0-9]{2}-[0-9]{2}T[0-9]{2}:[0-9]{2}:[0-9]{2}(\\.[0-9]{1,6})?Z$"
    },
    "source_timestamp": {
      "type": "string",
      "description": "When the underlying event happened at its source (UTC, RFC 3339, `Z` suffix). The convergence ordering key.",
      "pattern": "^[0-9]{4}-[0-9]{2}-[0-9]{2}T[0-9]{2}:[0-9]{2}:[0-9]{2}(\\.[0-9]{1,6})?Z$"
    },
    "freshness": {
      "type": "string",
      "description": "Producer's statement about the evidence. Missing or unverifiable evidence is `unknown`, never `live`.",
      "enum": ["live", "stale", "unknown"]
    },
    "status": {
      "type": "string",
      "description": "Closed, normalized lifecycle vocabulary. Terminal: succeeded, failed, cancelled, interrupted, expired, rolled_back. Non-terminal: pending, running, unknown. `unknown` means the source cannot prove the outcome; it is never converted to success. A closed enum (not free text) is used so convergence rules are well defined and no free-text channel exists.",
      "enum": ["pending", "running", "succeeded", "failed", "cancelled", "interrupted", "expired", "rolled_back", "unknown"]
    },
    "evidence_ref": {
      "type": "string",
      "description": "Opaque reference to evidence held elsewhere (for example an audit record locator). Never the evidence itself.",
      "pattern": "^[A-Za-z0-9_.:/#-]{1,256}$"
    },
    "classification": {
      "type": "string",
      "description": "Data classification of the envelope per ADR-0029 / docs/ai-data-privacy-and-model-security.md section 4. Required; there is no default.",
      "enum": ["PUBLIC", "INTERNAL", "CONFIDENTIAL", "RESTRICTED"]
    },
    "redaction_state": {
      "type": "string",
      "description": "none_required: carries only identifiers and enums; redacted: a sensitive value was removed before emission; withheld: the producer deliberately omitted detail.",
      "enum": ["none_required", "redacted", "withheld"]
    }
  }
}
