{
  "schema_version": "1.0.0",
  "event_id": "evt-omes-job-0001",
  "source_authority": "omes",
  "tenant_id": "tenant-acme",
  "correlation_id": "corr-2026-10-03-deploy-0001",
  "causation_id": null,
  "run_id": "job-7f3a9c21",
  "operation": "deployment.apply",
  "event_type": "job.state_changed",
  "observed_at": "2026-10-03T10:00:05Z",
  "source_timestamp": "2026-10-03T10:00:04.250Z",
  "freshness": "live",
  "status": "running",
  "evidence_ref": "audit:jobs/job-7f3a9c21#12",
  "classification": "INTERNAL",
  "redaction_state": "none_required"
}
